ID,Comment
77,The quality of insights and the relevance of the topics discussed at the summit reflect the ongoing dedication to delivering a premium experience. The impact of the event on industry professionals is truly evident in the depth of discussions and connections made.
78,"The summit has been a source of valuable knowledge and meaningful connections, and I'm eager to see how I can build on this foundation moving forward. The thought-provoking sessions and the potential for continued growth and development make me excited about the possibility of future involvement in similar events."
79,"The VIP meet and greet had the potential to be a valuable networking opportunity, but the limited time for interactions left me feeling rushed. I wish there had been more structured activities or smaller group discussions to foster more meaningful connections"
80,"The summit's sessions were informative, but I couldn't help but feel a sense of stagnation in the content compared to a previous year. While the event continues to attract industry experts, I believe a more innovative approach to the topics covered would greatly benefit attendees."
81,"While the summit's lineup of speakers was impressive, I couldn't ignore the feeling of repetition in the discussions from a prior year. The event's value remains, but a more dynamic approach to the content would lend a much-needed sense of freshness and innovation."
82,Nada Arnot's session on the challenges facing the news industry at the Apogee Marketing Summit was highly informative. Her expertise shed light on the evolving landscape of media and its implications for marketing strategies.
83,"The VIP meet and greet was an incredible opportunity to network with industry leaders, and I had the privilege of engaging in meaningful conversations with like-minded professionals. The intimate setting allowed for genuine connections and valuable one-on-one interactions that enriched my summit experience."
84,"Having missed the Apogee Marketing Summit last year, I was eager to see how this year's event would compare to those I had attended in the past. The lineup of thought leadership sessions and the quality of the keynotes did not disappoint, living up to the standard I had come to expect from previous years. However, I did notice a shift in the topics being discussed, with a greater emphasis on digital trends and technology-driven marketing strategies"
